Tweet,Analysis
But to no avail. I tried to buy airtime of N1000 from my bank account using *822*1000# the next thing was i began to receive random alert seven times and credited N7000 airtime and debited 7000 i immediately called glo customer services i was advised to contact sterling bank,Weak
"Glo, MTN Taking Us For Granted – Customers Speak On State Of Networks The recent flood in Abuja due to the heavy rain pour may have affected the services of two giant https://t.co/emfw4PiZax",Weak
"That was it for meeee! Cause I've called zenith bank, Airpeace, Glo,Airtel, all of them had horrible customer services inshort i had it in mind that it was every Nigerian business that had poor customer service, but they proved me wrong 😍😍I LOVE YOU guys❤",Weak
 your services is poor and I can't talk to any of customer care rep with 121.   . Glo network is bad in my area for months and loss so many deals.,Weak
"  That’s the best decision I already abandoned mine after suffering times without number even on my own money, firstbank and glo offers the most worst services to their customers in Nigeria",Strong
   I was charged #832 for calling Glo customer services line (08050020121) and 123. Is this normal? Isnt the call supposed to be free?,Strong
"The amount of resources Glo waste in adverts, if they spend wisely their network/services could be stronger/better and will attract more customers. But they prefer advertising/marketing rubbish.",Strong
"Go to your settings; security: then sim lock. MTN default sim lock pin is 00000,  airtel is 1111, glo is 0000, 9mobile is 0000.
Banks won't help you after they hack your sim and get hold of your money, Customer care services will only apologise for inconveniences. Take heed!!",Neutral
 The worse network in the World. Very poor customer services. Common response to your customers you can't. Am regretting of using Glo  ,Weak
  You can actually work doing customer services at some store for explain like Publix and be 14 yrs old,Strong
 Glo ICM did not retrieve my SIM contrary to your directive here...I've visited your VI &amp; ICM Shops. I wonder if there is a miscommunication between your Twitter account and your physical services. I keep saying it...you should not treat a customer like this.,Neutral
 PLC Zenith Bank ur customers services call center is very x2 poor. Been calling ur so call 24/7 CS line since 1am till now ur are just swapping my credit like glo network. Since I've been using bank. This is the 1st time having midnight issues and to call u is wahala,Weak
"  Well, on behalf of everyone here at Customer Services I would like to post a cheeky GIF of someone doing the finger guns, but I can't do that, so I'll just say thanks a lot, and we're always here to help on Twitter if you need us :) Rob",Strong
" b)Customer earns subsequent loyalty points on every cumulative recharge of N1000.
c)First Recharge date should be later than opt-in date.

ii) Existing customers (Using Glo services for more than 3 months)",Strong
" Upon successful enrollment customers start earning CASHTOKENs as per below details
i) New Customers (Using Glo services for less than 3 months)
a)Customer earns first Loyalty point on first recharge of N200 &amp; above.",Strong
" has the worst customer care services, I called 121 some minutes ago for more than 10 minutes and I wasn't transferred to a customer care rep all I was hearing were jingle and  all sort, I have been unable to use my glo data since yesterday, what the issue?? Pls help.",Weak
"Whats happening to Glo network, I did whatsapp sub yesterday and also midnight sub and up untill now, I haven't gotten value, I called the customer services line and was asked to put  my phone in airplane mode for a minute then switch off, I did and still no difference.",Neutral
"      Because the customer is always right. Because Glo services can be really shitty, because tagging it fake news can bring a spell of fake news tags on genuine complaints.",Weak
" it is quite absurd and terrible that Glo cannot decentralise some of the services needed by their customers, imagine inability bro retrieve a stolen SIM card since April this year, getting to their Glo zone it is either no network, no link or sim is not available.",Weak
It used to be very easy to call a customer service to correct simple issues ... But you guys have outgrown the basics. Its okay. I WILL DISCONTINUE GLO DATA and use other services at ANY cost! And I will have NOTHING good to say about Glo to anybody! ,Strong
"  U can’t compare the banking sector with network providers.
Interm of customer services/satisfaction GTB is excellent.

Glo is good for my side.
I’m using glo 😋",Very Strong
  Instead for glo   to upgrade their facilities to global standard to be able to deliver fast internet services and other auxiliary services : promoting yeyebrities with hard earned monies of their subscribers ( customers),Strong
"   You're saying Glo, Airtel, MTN, 9 Mobile &amp; other networks went &amp; shutdown their services covering that area. Aside from your spurious conspiracy theory these coys are in the business of making money. Lekki is a VIP area, nothing will make them shutdown services to their customers",Weak
"Our Solution directly integrates seamlessly with all major Telecom operators and other service providers such as Multichoice, Mtn, Airtel, Glo, 9mobile, AEDC, IBED etc..., as they aim to provide value added services to customers through as many access points as possible.",Strong
"Spent my working life dealing with public. Manager Customer Services /Reception this is the worse response I have seen or would send.
 They don't care about COVID-19 or government advice which we are taking, just want the money
PLS R/T


",Weak
"$GLO is rolling out free broadband fiber upgrades nationwide for customers to enjoy better data experience.

Globe said it is migrating its broadband network from copper to fiber as part of efforts to continuously make its services better.",Strong
" i regretted using glo line for my telecom services
A gsm company that have no regards for their customers I .was instructed to visit their nearest office for my SIM registration which I do despite joining a long queue for days.",Weak
   It is a platform that ensure easy access to funds and help customers with the sale of their services.Glo,Strong
"Glo customer services in their offices is as slow as their network.
I stan the consistency.",Weak
" Fix your network issues around Ghana and stop offering cheap services, affordable services ain’t it all Quality counts.. have you people really had the chance to go around Ghana listen to your customers and their issues with internet not even one community can boast of Glo in gh",Strong
"MTN|| Glo|| Airtel  infact all telecommunication companies used by NIGERIANS should be boycotted. You charge us heavily on data subscription, calls and not to mention your poor customer services. Nothing has been done to mitigate the aforementioned! D least you can do is support.",Weak
GLO said the prices per gigabyte (GB) of its broadband services have gone down by more than 60% since 2016. The company said the price per GB it offers to its prepaid customers is among the “lowest” in the ASEAN region. ,Strong
 The lady on short hair and a guy called Segun on the left pick and choose customers to attend to. And despite my MS Teams call carried out in that office via my glo data the customer services always complain of network issues there. This is shocking,Weak
"Secureworks will support GLO’s Globe Business customers via integrated solutions that includes Red Cloak Threat Detection &amp; Response (TDR); Detect &amp; Prevent, for security defences; &amp; Incident Response Services, to help manage risk of breach.",Neutral
I really don't understand why a privately owned company will ask the customers that pay for services rendered to pay for maintenance of their equipment.  #Glo #9mobile #Etisalat don't ask us to buy fuel for their BTS. Why should  ask us to pay for such.,Strong
 Glo data services is f***kup. They are only good on hyped advertisements pattern to deceived customers.,Strong
 Still not had any community from Glo gym telling me about reopening and any changes in opening opening hours /restrictions ... guess customer    services are high on their agenda?,Strong
"  Imma clarify, u sound assertive and i respect dat, but ur lines sound abit exaggerated &amp; artificial. imagine Glo goes on bragging about how ""beautiful af"" their services are and yet have very little customers.",Strong
" We're committed to improving our services to give you the customer experience you deserve, Glo. Kindly check out our response to your private message, thank you!",Strong
"#BBNaija
Good morning Twitter tweeps..
We sell Data at an affordable rate, MTN, Glo and 9Mobile..
Our services are fast and reliable..you are just a DM away...

Kindly help like and retweet. my customer might be on ur list😭😭‼️‼️🙏🙏🙏❤️ https://t.co/bp2Qr2EwsQ",Strong
"At Glo office. Apparently it’s not only their network that’s slow, their customer services didn’t fall far from the tree https://t.co/e876ax193c",Weak
You ever call Glo customer services representatives wey them pick before 🤔?,Neutral
" Data issue, no network,  I'm in Abia state university, 
Glo network is not in any way available there... 
If your services are down in a whole university with thousands of potential customers, I wonder where it will be available.. 
Maybe in the morgue",Strong
" Data issue, no network,  I'm in Abia state university, 
Glo network is not in any way available there... 
If your services are down in a whole university with thousands of potential customers, I wonder where it will be available.. 
Maybe in the morgue",Strong
 your customers living around Agba Ekwulobia in Anambra are frustrated by your poor network services. We have reported severally for 4g connectivity and you people seem not to be concerned and doing anything about it. We may be leading a campaign against GLO in Ekwulobia,Weak
"To be everywhere they went. Glo, on the other hand have told their customers they're the grandmasters of data. 

Two brands providing identical services but both have managed to stand out with a unique promise. And if you noticed, they've both kept to their promises.",Strong
" pls I love your services too much to see you guys ""F"" things up of recent. Your service around some parts of Port Harcourt has been in its worst state of recent.
I'd hate to tweet this using GLO or MTN. I just want to remain a loyal customer, don't make me cheat✌🏾",Weak
", kindly advise on what steps to follow.
My glo line got blocked, apparently owing to its inactivity for a while now. The reason for the inactive state was mostly beyond my control.
How can I get it reactivated? I can't seem to reach your customer care services on call.",Strong
  Hi My RO GLO is under AMC since April Ro is not working no one came for repair. When I am trying to talk customer care services they are saying  ticket open agent will contact short.Kindly do the needful,Neutral
   Glo is generally poor with customer care and services,Weak
  This means u r not publicizing your services enough. I have been a glo customer since the inception in 2003 and I must say I'm disappointed right now.,Weak
" Interesting. Good to know that your offers are not constant and subject to changes without recourse to informing your customers in such services of such changes. I know the data volume I would have gotten from Glo or Airtel with the N5,000 I spent on MTN. ",Strong
   kindly stop your airtime sales services if you will always end up disappointing your customers. Kindly revert my 1500 airtime deduction for my glo line,Strong
"Glo, MTN Taking Us For Granted – Customers Speak On State Of Networks The recent flood in Abuja due to the heavy rain pour may have affected the services of two giant https://t.co/emfw4PiZax",Weak
"I'm seriously disturbed,worried,perturbed! I don't know which word to use again!  are not doing well at all! Y now? Subscribed 3k and could not even enjoy it for a day!!! Glo I swear, if u don't find solution to dis erratic services count me out as ur customer! Kilode??",Strong
" I have been using my Glo SIM for days now and ever since, I have been been calling the Customer care for my line to be activated for 4G services. The 3G is killing🥺. I don't know why one has to suffer before we could enjoy full services🤷. 3rd week &amp; counting. ",Strong
#Business #company #customerservice Glo Awesome introduced for better customer services https://t.co/e2ZolPn4st https://t.co/L5ykn0yMB0,Very Strong
"Gloria Souter is up next! Gloria is from Huron, Ohio and is specializing in Sales and Services Marketing. After graduation, Gloria will be working full-time at Penske. She is being promoted from a customer sales rep position to a rental sales rep! Congrats Glo!  https://t.co/dejPjYHfA2",Neutral
Hello   don't you think is time for you stop providing data services to customers?  It is useless buying data that you can't even use because of bad network. I had to switch to another network to tweet you this.  Your data service is ZERO.,Weak
"* Mike Adenuga, (Globacom) donated over N1b to FG instead of giving his Glo customers free one month unlimited data to stay at home. 

But it's me and you that buy their products on daily basis, Just to make them rich. We used their services and pay for it and they make .....",Strong
 have you changed your USSD code for  customers? Or you both are beefing each other.. For the past 3 days I can't access the services on 3 different glo numbers https://t.co/XAdLYlDFrg,Weak
"instead of giving his Glo customers free one month unlimited data to stay at home. 

But it's me and you that buy their products on daily basis, Just to make them rich. We used their services and pay for it and they they make supernormal profits.

Now, look at how they punished",Strong
"to FG instead of giving his Glo customers free one month unlimited data to stay at home.

But it's me and you that buy their products on daily basis, just to make them rich. We used their services and pay for it and they they make supernormal profits.
Now, look at how they punish",Strong
"(Globacom) donated over N1b to FG instead
of giving his Glo customers free one month unlimited data to
stay at home.
But it's me and you that buy their products on daily basis,
Just to make them rich. We used their services and pay for it and they continue to make supernormal pro",Strong
" Well Glo na the baba ni
Data na Dem get am
Bonus on calls na them get an
Excellent customer care services
And na we still come get am
#Naija4life",Very Strong
"  Oh my got.... U finished Glo... Glo is actually making their money from services rendered to companies I guess, so dey don't care abt prepaid customers sadly, our indegineous network ooo",Weak
" Glo Mobile runs on the services of Glo 1, the first and only privately owned optic fibre cable system in Africa, running from United Kingdom to Africa, which delivers huge data bandwidth to customers, we are better placed to offer the best of data services to customers .",Strong
" Since I came to bono east,my Glo data refuse to on. Why, called your customer services they refuse to pick up.",Neutral
All the #networkproviders in #Nigeria     couldn't give there numerous customer's free data at Covid-19 lockdown sit at home to browse. But with poor network services.,Neutral
"    To be fair, I used to rely on  for my data services &amp; portion of voice calls but switched to MTN around 2016 when glo nearly blew my budget with a multitude of unexplained deductions! The customer care standard was also beyond atrocious!!! Except they since changed...",Weak
Instead of you guys to credit ur customers account with free data to easy their pains at trying period rather all you could to is to send an SMS to me to stay at home and use my money to access your services. Glo network Una no dey shame walahi.. https://t.co/tWzrL3YiAe,Strong
"Dear Customer,
In light of the Govt. order to shut down due to COVID-19, our operations team is in place to ensure that you continue to enjoy the network services.

Glo you are doing well",Strong
"I've not seen one multinational that offer services to customers give out free services this period. MTN, Glo, Airtel, 9mobile, Dstv, etc. Not one",Strong
"The difference between black men and white men: Companies all over the world are offering free services to their customers in a trying period like this COVID-19 but not in black men countries.
Black men will press you more and  make more money.Examples are: MTN,GLO,Airtel,9Mobile",Strong
"THIS IS WHAT SOMEONE GOT FROM T-MOBILE.
FREE UNLIMITED INTERNET DATA. COMPANIES IN DIFFERENT
COUNTRIES ARE OFFERING THIS KIND OF SERVICES TO THEIR CUSTOMERS . BUT OUR MTN, GLO ,AIRTEL  AND 9MOBILE  ARE NOT https://t.co/N6p8cKl30p",Strong
" Glo Mobile runs on the services of Glo 1, the first and only privately owned optic fibre cable system in Africa, running from United Kingdom to Africa, which delivers huge data bandwidth to customers, we are better placed to offer the best of data services to customers .",Strong
Hello Tweeps🙋🏻‍♀️. Those of you that are having problem with their GLO Line kindly meet my Cousin 😂 he going to handle the Glo Customers Care Services Today... Comment with your problems under this tweet🤗🙏🏻... Cousin please be patient with your customers😌.,Strong
Glo Data Plans are very affordable with flexible internet browsing plans. Glo mobile offers high-speed 3G and 4G internet services to its customers across Nigeria. 500mb for only N200 &amp; 6.75gb for N1500. Dail *777# to subscribe today.,Strong
"  We are glad to get this feedback from you. We keep ensuring our esteemed customers are delighted with our services. Thanks for choosing Glo!   

CA",Strong
 you have allowed these private banks steal from and giving us poor services. They can never help your business or give you loan as a loyal customer. Why not provide mobile banking services for us like Mtn or Glo mobile money so we can be saving our money there. It’s beta,Weak
"Natcom Chairman, africell GM, Orange GM all of you are big cheats and mess to the nation of Sierra Leone. Think about GLO and MTN making their customers happy with good services they are providing in Nigeria and Ghana. But you’re busy finding ways how to exploits us in SL🇸🇱",Strong
 hey  in the history of customer service u guys have the worst customer service ever. Maybe u guys are just slightly behind glo in providing services,Weak
" I'm ashamed of ur services both in ur offices &amp; data/call services.. Everything is very very poor services. No single consideration for customer time and money. Glo is d MOST USELESS NETWORK in the world, can't enjoy ur call, browsing &amp; even ur walk-in service is worse",Weak
  Stop cajoling customers Glo. U offer shit as services and try to pretend you are on top of situations.,Strong
 Today I was disappointed with your services in glo office here in yola. I wish you can send a supervisor to see how customers are treated and I wish you can provide a customer service satisfaction register to see how customers will respond. 3 hours just to register,Very Weak
"I can't imagine waiting for 2hrs+ just to get a Sim card from glo office..

Customer service and centres as slow as their 4g internet services..😏😏",Weak
"Monitoring ads on electronic media locally &amp; Internationally, Glo is spending more than MTN.
MTN make more money and has more subscribers than Glo. 
Good products with robust customer care service advertise itself. Glo should work hard to improve on there network &amp; services.",Strong
"Yes it advertises but it's just a way of educating the customers and also informing them about the various services (just like Glo and MTN do), they do pick up. I've called a few times, they also respond to mails too.",Weak
 Glo am not happy with your services especially your customer service is zero. I called now to complain about unauthorized deductions on my acc anytime I recharge.your agent said that my line could not be updated due to technical issues on top my #200.08158648724.,Weak
 Glo am not happy with your services especially your customer service is zero. I called now to complain about unauthorized deductions on my account anytime I recharge. Your agent said that my line could not be updated due to technical issues on top my #200. I am need explanation.,Weak
 I must tell Glo that I love your effective services to customers online. Keep it up. It's a good way for people that cannot call to contact you guys. Kuddos,Strong
" Stupid glo, your customers are busy battling with network issues and poor services and you’re here asking people their favorite street food. Useless people",Weak
"This pass includes....
2 Spa Services
1 week Sunless tanning
1 YEAR of UV Tanning
All Free!!!!!!
NO COST NO FEE JUST FREE!!!
https://t.co/u8BNLfvtKf
New Customers only....  Glo Sun Spa Copperfield https://t.co/KNfYVm3C4W",Strong
"This pass includes....
2 Spa Services
1 week Sunless tanning
1 YEAR of UV Tanning
All Free!!!!!!
NO COST NO FEE JUST FREE!!!
https://t.co/0tifm5VclD
New Customers only....  Glo Sun Spa - 1960 &amp; Eldridge https://t.co/bbg64ZVw5k",Strong
"Our customer portal is LIVE! Create a free, no obligation account for your salon today to get started with #GLO #salonrecycling services. https://t.co/VL24LPW76T https://t.co/WqS9C4qDrQ",Strong
 I stand to be corrected. What is/are the benefit(s) they get from signing celebrities with huge money and giving customers poor services. Glo especially.  I still don't understand why infinix will sign someone tweeting with an iPhone.,Strong
"$TEL, $GLO, $ISM: the 3 major mobile operators are working together, tapping global technology svc provider Syniverse, to enable number porting services in line with the government’s initiative to allow customers to switch mobile services without changing their mobile numbers",Strong
" I made a tweet about my 4g lte sim not receiving 4G services and you guys said you were working on it, it's been more than 2 days and am yet to receive 4g services on that sim. What is the problem? Is glo 4g sim not truly 4g and rather just a name to attract customers?",Strong
"   Them say make una wake up. Just one person say him dey enjoy una service, you guys rushed out to acknowledge him. Is it one customer you provide services for, abi na millions of Nigerians. Wake up glo before una glory go depart.",Strong
" We have improved on our services enormously in the recent past, and we want to enhance customers’ experience continuously, may we have your number for quick assistance. Get 50MB data free by recharging your Glo number online simply dial*555# . Thank you for using Glo Mobile…~A.W",Strong
" We have improved on our services enormously in the recent past, and we want to enhance customers’ experience continuously, May we have your number and exact location for quick assistance.Get 50MB data free by recharging your Glo number online, simply dial*555#,thanks…~A.W",Strong
Glo mobile offers high-speed 3G and 4G internet services to its customers across Nigeria. Glo Data Plan has some of the best priced data plans.  #Glomobile #internetpackages #mobileservices https://t.co/oF4sElEXwr https://t.co/knpDQvoV0L,Strong
 Please MTN Ghana is not the only Telecommunication network providing bad services to customers   Glo Customers are still not able to send Text messages for over 2 months now don’t pretend you don’t know this.,Weak
"   Chale dem sef dem no be stable, all de Telcos for sign agreement to provide better services to customers at good rates. We for get value for our monies",Strong
"You see Glo! As in Global com their services might not be satisfying to all customer's ,but they sleep on ads and marketing . I look at them I just assume Glo pushes out adverts every week worth millions, even people wey de sell ticket to heaven no do advert reach glo",Strong
 GLO customer care services is just too slow for my liking 🤦🤦,Weak
" Please you need to know that Glo network is bad, and you have customers because of your services in data, if this data service is withdraw no need to use glo line",Weak
what is the function of  customer care services that cnt pick calls?,Neutral
", I want let you know that customers' satisfaction is about the quality of services received from the provider. I hate seeing Edge on my Smartphone. Glo is the only ISP with this. Remember one Lagos Guy also complained of that. On MTN, Airtel, whenever you put on your",Weak
"Glo, MTN Taking Us For Granted – Customers Speak On State Of Networks The recent flood in Abuja due to the heavy rain pour may have affected the services of two giant https://t.co/emfw4PiZax",Weak
 I've never been this kind of disappointed with any network before. GLO customer care services seems to be the most useless and stupid set of people working there. I complained of over scratched card since 12 noon nothing has been done up till now.,Weak
 your favorite dead network. How on earth are you an ISP to all other networks? Your client provide better internet services to their customers yet glo subscribers use the worst voice &amp; internet services in this country. Tueh,Weak
Airtel has finally edged put GLO from second position in terms of overall market share (both in terms of internet subscribers and total subscribers). This is what you get when continually dish out extremely poor services to your customers.,Weak
"These glo Amebo adverts are so stupid. Your customers can’t use their airtime bonus to seal business deals, to market their goods and services, to check on family and loved ones. It must be senseless abd baseless gossip. Nonsense.",Weak
