Tweet,Analysis
" Hello , sincere apologies for that content. The word is also a nomenclature we use here with respect to our 4G services. Kindly disregard the message. No disrespect is meant. ​
***OGE",Strong
"Glo Unveils Data Roaming Services For Hajj Pilgrims - Customers of Nigeria’s foremost telecommunications company, Globacom, will enjoy affordable roaming data to stay connected with family and friends back home when performing their holy pilgrimage to Mecca and Medina.
The com... https://t.co/QF5unMVRRD",Strong
"Glo unveils data roaming services for Hajj pilgrims - Customers of Nigeria’s foremost telecommunications company, Globacom, will enjoy affordable roaming data to stay connected with family and friends back home when performing their holy pilgrimage to Mecca and Medina.
The com... https://t.co/PZrflC8uEy",Strong
" Only for me to put my pin I saw ""Airtime purchase of 19,900 has been successful""
I called my bank customer care line and they said there's nothing they can do I should call my network provider line 
I called glo customer care services and the person that answered me was like",Strong
"MTN, Glo, Airtel, and 9mobile stated their firm intention to disconnect bank customers from accessing bank services through USSD shortcodes codes",Weak
"  MTN, Airtel, Glo, 9Mobile Announced Single Codes for Data, Airtime, 11 Other Telecom Services. 

NB. Advise your customers accordingly. 

Don't say i never did anything for you!",Weak
 Greetings . This is not the experience we want you to have. Please know that we are dedicated to customer satisfaction and that we want you to have a positive experience with our services....,Strong
"The NCC has released a directive that as of May 17, 2023 Nigeria must switch to one set of
harmonized service shortcodes for checking airtime and data balance, subscribing to new services and calling customer service. MTN, Airtel, Glo and 9mobile users should take note of this. https://t.co/NnceQ7FjCj",Strong
"The NCC has released a directive that as of May 17, 2023 all telecom networks in Nigeria must switch to one set of harmonized service shortcodes for checking airtime and data balance, subscribing to new services and calling customer service. MTN, Airtel, Glo and 9mobile users should take note of this change. No longer will *556#, *123# or *232# work!",Strong
"The NCC has released a directive that as of May 17, 2023 all telecom networks in Nigeria must switch to one set of harmonized service shortcodes for checking airtime and data balance, subscribing to new services and calling customer service. MTN, Airtel, Glo and 9mobile users should take note of this change. No longer will *556#, *123# or *232# work!",Strong
"Nigerian mobile telecommunications companies consisting of MTN, Glo, Airtel and 9mobile are set to disconnect bank customers from using the Unstructured Supplementary Service Data services due to the N120bn debt owed to the operators.",Weak
We’re excited to join GLO Healthcare – an expanding healthcare group created by CapVest – and continue advancing the #eClinical and #regulatory solutions and services our customers rely. announcement: https://t.co/EhNE7n4FKh  https://t.co/slWdPTZhf7,Strong
"In a sane country,by now an OEM or a MNO such as MTN/Airtel or Glo would have grabbed you, given you all the certification needed and supported you to open up your own super centre where you can give more customers personalised services for lesser charges. In turn you training more people thereby creating employment. But we're not in a sane country. Nigeria is upside-down 
Kudos to you bro keep up the excellent work and customer service!
#Obidients",Strong
 glo tops the chart of bad networks since 2017.i keep calling the customer care and they tell me things that dont work.I WISH A STRONG NETWORK COMES AND CLEARS ALL these BAD SERVICES,Weak
" Frankly speaking I don't like you people services.. this is almost 3 months now I mistakenly sent Glo credit card to an Mtn line, and I called the customer cares but I'll tricked and I sent emails to https://t.co/epDHQDsN5k or whatever they sent me to send an email, I",Neutral
"Our devoted customers of Glo Heated Tobacco Devices #HTD's were left with useless devices due to the unavailability of  's cigarettes in Egypt. This deceitful move by BAT has cheated customers of #Kult, who trusted and relied on us for quality products and services.",Weak
We’re excited to join GLO Healthcare – an expanding healthcare group created by CapVest – and continue advancing the #eClinical and #regulatory solutions and services our customers https://t.co/EhNE7n5dzP  https://t.co/slWdPTZP4F,Strong
We’re excited to join GLO Healthcare – an expanding healthcare group created by CapVest – and continue advancing the #eClinical and #regulatory solutions and services our customers rely on to develop and bring https://t.co/EhNE7n4FKh  https://t.co/slWdPTZhf7,Strong
" Glo please do something about your network. It’s very frustrating. I have been complaining since Saturday. Your customer care services keeps repeating same lines. I can’t browse, have to wait for minutes to load a page",Weak
We’re excited to join GLO Healthcare – an expanding healthcare group created by CapVest – and continue advancing the #eClinical and #regulatory solutions and services our customers rely on to develop and bring life https://t.co/EhNE7n4FKh  https://t.co/slWdPTZhf7,Strong
We’re excited to join GLO Healthcare – an expanding healthcare group created by CapVest – and continue advancing the #eClinical and #regulatory solutions and services our customers rely on to develop https://t.co/EhNE7n4FKh  https://t.co/slWdPTZhf7,Strong
"  Hello Glo team, this is totally unacceptable.  If you're having issues with your network why not come out to inform your customers this is bad of a company like you. You need to do something urgently about this poor services.",Weak
"Can people stop mentioning customer care services under a popular and trending tweet.

Any catchy news has gazillion of MTN, glo, gtb, access, Zenith, kedco, Edco etc complaints.

You have to swim through all these miscellaneous requests to read reactions.",Strong
"Network providers, like mtn, glo &amp; others do inform customers in advance, if they sense poor network. Why can't banks do the same to avoid all this incessant transactions failure?! We're sick of the terrible &amp; inefficient bank services. Get it fixed now or lose your customers.",Weak
" Dear Zenith, as a  concerned customer, I want to sincerely tell you guys that your services are no longer at the zenith. Every failed transaction is either from zenith or going to zenith.

Leave ads, take your time to work on everything, don't be like glo, please.

Eluu P",Neutral
"   U guys keep apologising but still do nothing. Only God knows when  customers ve bn complaining but no improvement. But keep spending millions of naira on advert u dnt need. We all knw glo exist, y not cut stone dis advert n focus on hw to improve ur services. My little opinion.",Weak
"  To an extent, glo has mad plans. N dy r not as bad as you tink if u are at a place with strong glo servers. Omo no hype customer care services because glo is one of the best for me, mails r returned, calls are top notch!!",Strong
"Today is Friday, a day meant specifically for a touch-up with Our relatives and friends,

ADH DIGITAL SERVICES in support of the above is giving an ~5% discount to Our dear customers today;

MTN 1GB=N250,GLO 1GB=N275 
AIRTEL 1GB=N275, 9MOBILE 1.1GB=N450

Mobile number:08160176005",Neutral
"The worst thing that can happen to you is using a combination of zenith bank and glo.  y’all have the poorest banking services. Online your app isn’t working. Offline you’re either not open or your customer reps are rude af. Shame on you, give me my 50k! Useless bank.",Weak
"3. 9mobile and Glo are also popular choices for customers and offer competitive pricing and services.  Though on the larger scale, they are not much threats as national carriers and play better as regional networks.",Strong
"Glo has a good number of employees &amp; the majority of them work in the Glo customer care unit, providing a range of services to the network’s subscribers.

https://t.co/VuFBRfZXF2 #Glo #Globacom #CustomerCare #CustomerService",Very Strong
" so this issue of me being unable to make calls is not only affecting me, pls let the glo staffs look into this glitch/fualt ASAP because it disgu'st me. I can't even call the customer services, I had to come here!",Weak
We’re excited to join GLO Healthcare – an expanding healthcare group created by CapVest – and continue advancing the #eClinical and #regulatory solutions and services our customers rely on to develop and bring life-saving treatments to patients faster. Read the full announcement:,Strong
We’re excited to join GLO Healthcare – an expanding healthcare group created by CapVest – and continue advancing the #eClinical and #regulatory solutions and services our customers rely on to develop and bring life-saving treatments to patients faster. Read the full announcement:,Strong
"I called GLO customer services . I was told that they couldn't locate my status. It is very unfortunate

   ",Weak
We’re excited to join GLO Healthcare – an expanding healthcare group created by CapVest – and continue advancing the #eClinical and #regulatory solutions and services our customers rely on to develop and bring life-saving treatments to patients faster. https://t.co/O8JU3qmUoo,Strong
"We’re excited to join GLO Healthcare – an expanding healthcare group created by CapVest – and continue advancing the #eClinical and #regulatory solutions and services our customers rely on to bring life-saving treatments to patients faster. https://t.co/jw4B3OUkRz
 #clnicaltrials",Strong
  You guys should put in more efforts in delivering hitch free services than all these unnecessary activities. Can't make calls or connect to the internet since 3pm. Had to beg a Glo customer to Hotspot me.,Strong
"#ZenithBank please work on your services, I've been outside your bank since 9am. The customer number tags are up to 90 meanwhile, number 21 was  just being called in by 1pm🙄. It's a shit show. You guys should do better please.",Strong
"https://t.co/UnpEYK7L0q

Have you heard about the latest VTU PLATFORM that Sells data at cheaper rates?

Do you know that ! You can buy data bundles ( MTN, GLO , AIRTEL,  ETISALAT) at the rate of 240# per gb and resell to your customers at the rate of 300# - 500#

Other services. https://t.co/Jk1dT501PH",Strong
"Organisations with the shittest customer service lines: Registrars and Network Services.
First Registrars and Coronation Registrars are top top on that list, right after Glo and Airtel.",Strong
" I can't even make calls with my Glo sim for the past 6days now,am really sad right now to the upgrade you guys did to Glo network, it made the services to your customers poor nd worse",Weak
"  The whole of Bida is out of coverage, customers without GLO or Airtel lines have been disenfranchised from accessing both calls and internet services. I'm not the only one affected.",Strong
"
I couldn't make call on my glo sim card since 7th Nov. 2022. I've called customer services several but nothing have changed
08058524222",Neutral
" Why is your app not working. The evil you do will lead to your downfall. Glo has the cheapest rate in every of their services. Glo has to build their system well, mobile service money and expand this will increase your customers in Ghana. ls time we all move to Glogh",Very Weak
"IHS’s core business involves providing shared telecommunication infrastructure services to its customers like MTN and Glo. Two weeks ago, they received a credit rating downgrade. 

What is the cause of that downgrade?  answers.

#StearsPremiumToday
https://t.co/9UgrEyhI9T",Neutral
pls what the fuck happened to glo those days I was unable to call still calling their customer services not even pick up the call ,Weak
" I'm having problem with my Glo Line. I was given this notice (Dear customer, your main account balance is very low. Kindly recharge to continue enjoy our services.) but no access to refill my account",Strong
" one of the poor network service provider in Nigeria currently now which I will never recommend you buy is #Glo #Network because of the crippling services provided to their customers daily. Have been reporting this for over a month now in my area.
#GoViral
#Trend",Weak
"  I heard that glo network was really bad, what's even poorer is their services, I just woke up and suddenly: I am not authorized to make a call, this is just bullshit.

Tried reaching out to customer care, but that's even worse.

Be like na to just go back to MTN

 https://t.co/EvaPbBSgst",Weak
"  Your data services is verrrry poor... You have data but looking for network to use the data, I will never buy glo data again. customer service also poor. These network providers treat us as they like but the government don't care too.",Weak
" So glo staff and customer Care service are doing scam, for Breach of Contact,  I do Sim swap since Saturday morning till now, the Sim isn't working, customers services regeting my calls, 08070757021, after today the law court we judge the matter, thanks glo.",Strong
" I agree that the society compels some women to take this dangerous step to enhance their looks.

I was reliably informed that GLO Nigeria only employs fair people for their call or customer services.

You stand no chance of being employed into this role if not fair skinned.",Weak
"Just wondering why these communication outfits such as GLO not limited to that alone, spent so much on advertising their products yet dishing out horrible services to their various customers.",Weak
"Our aim is to provide all network data services at very affordable price. To reduce our buyers data bundle subscription expenses.

Why us?
● FAST delivery
● 30days validity is certain
● 24/7 Customer Service Support

#service #serviceprovider #data #airtel #mtn #glo #telecom https://t.co/nj5Ts7MEzI",Strong
"Without reasonable doubt, I believe  customer care agents don't use Glo lines; Like, how can you be so clueless about the services your firm provides?
It baffles me",Neutral
"New Opening!
Customer Service Specialist
Locatation: Fairfield, New Jersey
Apply Here -&gt;https://t.co/5XM74k8Nut
Job Description

Summary

As the Customer Service Specialist, you will be responsible for coordinating SGS services locally and glo",Strong
" To get a lasting data, switch to glo. And turn it to 3G lol. Or dm the glo customer services with your number and network complains to make the 4G work well. They take the less data among the rest.",Strong
"The amount of money  Nigeria spend on advertising, if that amount is spent on improving their services, they would need much adverts to get customers.",Strong
 PLEASE WE NEED MORE GLO CARE AGENTS TO ENABLE SERVICES RENDERING FAST. BECAUSE MY EXPERIENCE IN GLO OFFICE OFF AMINU KANO CRESCENT ABUJA WASN'T SWEET AT ALL... JUST TWO  PERSONS  ATTENDING TO CUSTOMERS FOR SIM REPLACEMENT Out of how many seats and chairs in that section. Thanks,Strong
"Customer Appreciation Sale 🎉💕

Starting August to celebrate the anniversary of GLO by Darrian LLC, the first 10 people that book starting august 1st will get a 30% discount on services. 

**Will announce my product sale later today ☺️🫶🏾 

🦋 https://t.co/Ery2GgvzBa",Strong
"Hello this is AFFAN data services.
 we got you covered for all network subscriptions
MTN
GLO
AIRTEL
 9MOBILE
And your TV Subscriptions

Ask Around we have the most Affordable Rate
Trusted by 1700 loyal Customers
#BBNaija #japa #pvc #2023Elections

Link- https://t.co/xsS0N1Fhuv https://t.co/IAVnNOGe0f",Strong
 your services are very poor in southern ijaw local government area in Bayelsa state. Only on glo that one cant deactivated auto renewal for a data that has been exhausted even after your customer care on phone. Thats ver frustrating.,Weak
GLO services are always so useless. Their customer service is just as useless as the network,Weak
"Airtel and Zenith Bank having a lot in common, recently,....one notable one is failing customers when they need their services 🥲...the real deal breaker 💀😣😭 glo https://t.co/nEl0E9iVVw",Strong
" Thank you for providing me an excellent alternative from MTN, Glo, and Airtel. Keep improving your services in PH and assure you your customer base will only keep rising.",Strong
" since Globacom had an arrangement with Airtel, those with Glo SIM Cards are being denied access to all services including contacting customer care. This is unfair, the regulator should stop this IMMEDIATELY and those affected compensated. Pls share to all",Weak
" Lmao Starlink would bring in quality of services, Starlink competitors isn't directly MTN and GLO though. It's not mobile data. 
Would compete with fiber connections and co, who already charge business and top end residential customer large fees.",Strong
   i really appreciate your services as a  GLO customer but but my issue is that my GLO line was deactivated please how do i go about it please?,Strong
"#News: Customers of Ghana's smallest network, Glo, can expect improved services due to a national roaming agreement with  for voice, data and SMS services.

#ConnectingAfrica #AirtelTigo #Ghana #GloGhana #Glo #Roaming  

https://t.co/gn7uKRyQGT",Weak
"Glo Customers are now on AirtelTiGo. 

They remain and enjoy their existing Glo services but they are powered/networked by AirtelTiGo. 

A roaming agreement between the two companies made this possible.",Strong
“It is worth noting that all other conditions of service remain unchanged. This means Glo customers will continue to recharge with Glo’s scratch cards or electronic credit transfers and enjoy all existing Glo products including value-added services.” https://t.co/bCKzJKLAbN,Strong
"In a press release today, Glo Communications stated they were partnering with AirtelTigo which would be a ""National Roaming"" arrangement for voice, data and SMS services. All Glo customers will be transferred to AirtelTigo's network on 23rd April. https://t.co/HmtgFh8Aiu https://t.co/IFxTkHFr3a",Neutral
" Roaming simply means using the services of one network whiles you are on another network. For instance, Glo customers who are out of Glo coverage areas, will be allowed to used AirtelTigo network services. We hope this is clear enough.",Strong
"Nigerian multinational telecoms company, Globacom Limited; popularly known as 'Glo', has entered into an agreement with AirtelTigo, to improve its voice, data and SMS services to customers. See release for details 👇. https://t.co/RtT7prvQE5",Strong
"Less than a week before the Christmas holiday, French IT services company Inetum Group was hit by a ransomware attack that had a limited impact on the business and its customers. [...] Glo... via  #security #tech #ThursdayThoughts https://t.co/2f3lGXci1Y",Weak
" This is exactly the same this customer services tell me whenever I call.
Do you think I'm a child and won't know how much data I consume per kilobyte?
I used MTN and Glo and they work perfectly and I consume every bit of their night plan.",Strong
" MTN  internet connection in Winneba is very  bad,not stable,on and off 
Customers are complaining bitterly but nothing has been done to correct the defect.

Also with regards to GLO network in Winneba,anytime ECG power goes off, Internet  and other services go off  
Please !!",Weak
"In the end, you will discover that the services of these agencies that persuade their workers to get customers end up being shitty.

What happened to that Glo sim I bought? I didn't use it up to 6 months, it just stopped working and that was the end. 

Shitty service.",Neutral
 You waste money on advert while ignoring the quality of services rendered to customers. I will never forget my experience in the hands of glo.. Poor network everywhere...,Weak
" Glo have had same issues for years now,one wonders if they intend to give customers,the services they deserve",Neutral
" Glo is the best in my area. It's practically flying ✈
I'm disputing that they are shitty. They shouldn't invest in improving their services and not lavish money on celebrities.
Branding can attract, but your services retains your customers.",Very Strong
Man too many ideas out of their time or simply unable to capture value from. I remember pitching a One year Data subscription to Glo and Airtel in early 2015. 10TB for 200K. Lock in the customer and pull value through bundled streaming services. Just saw that Glo is doing 1TB for,Strong
"Some of you that uses glo line to register for some online applications and services especially crypto and exam form. 
What makes you think you can receive otp?
If you like call customer care from now till eternity nothing for you.
Use other networks and have peace.",Weak
" There’s hardly an incentive to do so, from an institutional POV. It’s like, why’s Glo not improving network given everyone knows they’re terrible?

People use these services regardless so to the institution is measuring usage instead of customer satisfaction.",Weak
 glo has the worst services including Theo customers services. I believe they deserve an award to denote how poorly their services are.,Weak
" Conductors 
Nurses 
Prostitutes
Customer care services (especially glo ) 
Sales girls 
Local restaurant owners",Neutral
"This Glo Advert with AJ &amp; Don J. Is my favourite, however Glo invests heavily on advert and lil in actual business of providing quality services to her users cum customers. Glo do better .",Strong
"$GLO: Disclosed that it hauled in over 349,000 new subscribers and improved services for 640,00 customers after aggressive rollout and network build this year.",Strong
"This is the second glo office have been to. The first office said only 25 people are attended to a day. Time is precious to everyone,  please do better in giving your customers better services",Strong
"We're pretty proud of the glorious IT services and support that we provide to our Glo customers. Check out what kind of IT experience you can square away for your business.
https://t.co/pbTrsh4Uqx
#solutionsnotproblems #ITforbusiness #businesssolutions #ITsupport https://t.co/UkzkXsPpCq",Strong
     services completely 0. GLO is a complete stupid network. Customer service 0. Resolving issues 0 in fact everything is -50 nothing 2write about... Believe If u are reading this ... Speaking from a sad experience &amp; I won't want any of u 2b victim,Weak
     services completely 0. GLO is a complete stupid network. Customer service 0. Resolving issues 0 in fact everything is -50 nothing 2write about... Believe If u are reading this ... Speaking from a sad experience &amp; I won't want any of u 2b victim,Weak
       services completely 0. GLO is a complete stupid network. Customer service 0. Resolving issues 0 in fact everything is -50 nothing 2write about... Believe If u are reading this ... Speaking from a sad experience &amp; I won't want any of u 2b victim,Weak
 GHCare services completely 0. GLO is a complete stupid network. Customer service 0. Resolving issues 0 in fact everything is -50 nothing 2write about... Believe me If u are reading this ... I'm speaking from a sad experience &amp; I won't want any of u 2b victim,Weak
 services is completely 0. GLO network is a complete stupid network. Customer service 0. Resolving issues 0 in fact everything is -50 nothing 2write about... Believe me If u are reading this ... I'm speaking from a sad experience &amp; I won't want any of u 2b victim,Weak
"Our customers can roam, enjoy 4G, data services in China, UAE –Glo https://t.co/Xp4Br07IAW  #Nigeria #NigeriaNews https://t.co/OBdlbJq2g2",Strong
"Our customers can roam, enjoy 4G, data services in China, UAE –Glo - https://t.co/ZV21YjMxbZ https://t.co/0QnDS0Xy4O",Strong
"Glo Offers Customers Pre-paid Roaming, 4G Data Services in China, UAE - https://t.co/l0uMDmpFuH https://t.co/SwAubVO4nh",Strong
  I don't think I will use Glo again they are found of providing substandard services wit exorbitant charges yet customers don't get to enjoy what they are paying for. Hw on earth will I subscribe 4 DATA &amp; won't be able 2 use it yet they keep advertising 4G lite,Strong
You'll call Glo customer care to complain to them about their services and they will still be advertising their services to you before they pick  https://t.co/02ruOndlia,Neutral
" Glo is obviously better now. I’m thinking of porting sef cos people don’t really complain again but Airtel seems to have many customers now hence this unprofessional, unreliable and shitty services.",Strong
"Globacom, has unveiled Glo café, a self-care application that offers customers a convenient self-service channel to manage their accounts.
Globacom, in a statement in Lagos, said the new repackaged app was designed to unify Glo services under one

https://t.co/QuMP1ZmgfJ https://t.co/VCBBsYt8W0",Strong
"I am done with you   ... I know you may not miss small customer like me but the truth is I can't continue losing my money or paying for services I did not enjoyed.

TO WHOM IT MAY CONCERN
You can now reach me on my glo line. MTN dey do me wayo too much.",Weak
"Instead of Glo to spend more money on providing good internet services for their customers, they’ll use all the money to sign brand ambassadors, adverts while providing abysmal services to their customers.",Strong
"   can you stop all these unwarranted endorsements of celebrities who have more than enough for themselves and work on your services, it doesn’t make sense when the so called customers are not enjoying the dividend of their money. It sucks 🤦🏾‍♂️",Weak
